{
  "schema_version": "0.1.0",
  "id": "relevant-gap-unknown-area",
  "revision_id": "relevant-gap-unknown-area-r1",
  "spatial_reference": "OGC:CRS84",
  "geometry": {
    "type": "Polygon",
    "coordinates": [
      [
        [
          112,
          28
        ],
        [
          113,
          28
        ],
        [
          113,
          29
        ],
        [
          112,
          29
        ],
        [
          112,
          28
        ]
      ]
    ]
  },
  "definition_provenance": {
    "description": "Synthetic relevant-gap-unknown TargetArea fixture."
  }
}
