{
  "schema_version": "0.1.0",
  "id": "area-polygon",
  "revision_id": "area-polygon-r1",
  "spatial_reference": "OGC:CRS84",
  "geometry": {
    "type": "Polygon",
    "coordinates": [
      [
        [112.9000, 28.2000],
        [112.9100, 28.2000],
        [112.9100, 28.2100],
        [112.9000, 28.2100],
        [112.9000, 28.2000]
      ]
    ]
  },
  "definition_provenance": {
    "description": "Synthetic rectangle for Milestone 1 fixtures."
  }
}
